{
  "protocol": "MIF-INTEROP-DIFFERENTIAL/1",
  "status": "candidate-only",
  "suiteConformance": false,
  "baseline": {
    "mifCommit": "7e45d5a3fa970a535ed6a8a8ff5981aba4b9c978",
    "m3ClosureCommit": "736801412e11dee9d2bfb65082757e0609a5ade3",
    "m3Evidence": {
      "path": "interop/evidence/mif-1.0-candidate-4-m3.json",
      "sha256": "sha256:a354e810de0c74dd26226bee39b09f05c2677dbd693f95574fccc17d8c0c6671"
    }
  },
  "resources": [
    {
      "path": "artifacts/mif-1.0/corpus/fixtures/example-morris@1.json",
      "sha256": "sha256:360cbe9a5788ae8cf73c8acd7dcff0f021ad55c736e42648d43e000c5d1549e1"
    },
    {
      "path": "artifacts/mif-1.0/corpus/instances/mstate-offer-r1.json",
      "sha256": "sha256:d7723f2737e926447f36703855210d4e0582453c31066be2f5e88a1586742afc"
    },
    {
      "path": "artifacts/mif-1.0/corpus/instances/repetition-observation.json",
      "sha256": "sha256:1adddb4a7a9aab1e748b7b029e9c538ff78293ec553d8e1f16ebeca341472f76"
    },
    {
      "path": "artifacts/mif-1.0/index.json",
      "sha256": "sha256:5acbb714bed77e24eaac72fa5f24d2e54d1e17aaf568a8b60718c840281a6541"
    },
    {
      "path": "artifacts/mif-1.0/schema/decision-state-v1.schema.json",
      "sha256": "sha256:903edcf8e061b1f20059521adde48b35119d08a3dc2de5fba3971e05cfcdd405"
    },
    {
      "path": "artifacts/mif-1.0/schema/mif-1.0.schema.json",
      "sha256": "sha256:771f2c46ee4a83c08218caa5b026abfa98f72feb32b8945639c0340d73fd4bb9"
    },
    {
      "path": "artifacts/mif-1.0/schema/mifcap-1.0.schema.json",
      "sha256": "sha256:128f360c7c5944bbfee14e53cac08c5121e428f1d627205c2538470205c0d76d"
    },
    {
      "path": "artifacts/mif-1.0/schema/mifconv-1.0.schema.json",
      "sha256": "sha256:59544de0027eabd57c829806aac1cd7cb6db83906da7ec3b6c196183ac3a3ae7"
    },
    {
      "path": "artifacts/mif-1.0/schema/mifdiag-1.0.schema.json",
      "sha256": "sha256:1b4e056010d3ccef710959afebc7e368ff5d74d88f48301fadd9fa806a3d7f25"
    },
    {
      "path": "artifacts/mif-1.0/schema/mifinv-1.0.schema.json",
      "sha256": "sha256:4a36abfa4a2d11c05d3226fc7383790b2168389124f59fb6f610e887d9ef377a"
    },
    {
      "path": "artifacts/mif-1.0/schema/mifpos-1.0.schema.json",
      "sha256": "sha256:09948b711e585d6165fe14289305fa323875cbd01a51c780fb44d250dfd4db73"
    },
    {
      "path": "artifacts/mif-1.0/schema/mifsuite-1.0.schema.json",
      "sha256": "sha256:bc1e482dd4fea799c5c64f174e25f90d88640926df1852bae7618bec8292c090"
    },
    {
      "path": "artifacts/mif-1.0/schema/mifturn-1.0.schema.json",
      "sha256": "sha256:a893c0e602d8898c303731f3f3979b480f6ab2f129ce075d248968ddc820c38f"
    },
    {
      "path": "artifacts/mif-1.0/schema/mrs-1.0.schema.json",
      "sha256": "sha256:d250dca749510aaf643e75143244ff8bd02fe45aba7750b5a3fc295f20cd3709"
    },
    {
      "path": "artifacts/mif-1.0/schema/mstate-1.0.schema.json",
      "sha256": "sha256:33d9a6e025e5b41b5b77a743b7367cb35d929ac85c324d4cab11381a7d5b49b7"
    },
    {
      "path": "artifacts/mif-1.0/schema/repetition-observation-v1.schema.json",
      "sha256": "sha256:80fa305274e77bb6cd2bcb7c157f4d00f6be6e8fd6a2f6ef00708eaaf0bc0e0d"
    },
    {
      "path": "artifacts/mif-1.0/schema/resumption-state-v1.schema.json",
      "sha256": "sha256:42458db49a102cfc5ca3b332af1a9afc4fef085b64a9dad4d7ba966f5abc58ca"
    },
    {
      "path": "interop/adapter-protocol-v1.md",
      "sha256": "sha256:253c1d201ea1db625e0c534da445ca4ecaa0b07597dfc7dbf59fbd6adf89874f"
    },
    {
      "path": "interop/cases/differential-negative-v1.json",
      "sha256": "sha256:b4072a2fd786104c5344619a818d59b657904e92c419175e795cc03fcd0697ff"
    },
    {
      "path": "interop/differential-v1.md",
      "sha256": "sha256:57056faf5fc347dc97876ada350784feb84acff2324ef00175c915c6d019a133"
    },
    {
      "path": "interop/schema/adapter-cases-v1.schema.json",
      "sha256": "sha256:74877776612215ffa9c894ba659b7ce0e41b60fb4cb65e5b4f40a187b537ef7d"
    },
    {
      "path": "interop/schema/adapter-config-v1.schema.json",
      "sha256": "sha256:c5f8b850ae5330cf1e78b5fba639c08aef267a4c3c8ae1841b1467c8d84a79c5"
    },
    {
      "path": "interop/schema/adapter-message-v1.schema.json",
      "sha256": "sha256:c3ca996ab5380038e737300835a34bcbe949744140ecb3a72ee1db22f7fc03fc"
    },
    {
      "path": "interop/schema/differential-launch-v1.schema.json",
      "sha256": "sha256:4452be5b48e085ad7887985fd5066f899bb96b00bef225e2b8c8b41a740a1f60"
    },
    {
      "path": "interop/schema/differential-report-v1.schema.json",
      "sha256": "sha256:d69646ac0a3746d4ac72d3bb1958e28019813da48dc71ea80e45a1d6d253c29e"
    },
    {
      "path": "interop/schema/legal-actions-v1.schema.json",
      "sha256": "sha256:4dee9e268f37fc34123dc0498ca4706b25e271accc973b00ab3b8924c82bba1e"
    },
    {
      "path": "reference/jcs.py",
      "sha256": "sha256:dad5ba9ed0fedab9682540990866dd9805f30a668b2d6d84e690e19ac48c06f5"
    },
    {
      "path": "tools/compare_mif_1_0_adapters.py",
      "sha256": "sha256:b0ebeafe76e704725c3dc130b09d40236d0e453fa63378e2649d7c5b8270df48"
    },
    {
      "path": "tools/run_mif_1_0_differential.py",
      "sha256": "sha256:bcd23bf5666f3ba07e78e653fa4777a190719877341aa4e6adb159178fc6c505"
    }
  ],
  "prng": {
    "profile": "splitmix64-v1",
    "wordSize": 64,
    "seedEncoding": "lowercase-hex16",
    "constants": {
      "gamma": "9e3779b97f4a7c15",
      "mul1": "bf58476d1ce4e5b9",
      "mul2": "94d049bb133111eb"
    },
    "vectors": [
      {
        "seed": "0000000000000000",
        "outputs": [
          "e220a8397b1dcdaf",
          "6e789e6aa1b965f4",
          "06c45d188009454f",
          "f88bb8a8724c81ec"
        ]
      },
      {
        "seed": "0000000000000001",
        "outputs": [
          "910a2dec89025cc1",
          "beeb8da1658eec67",
          "f893a2eefb32555e",
          "71c18690ee42c90b"
        ]
      },
      {
        "seed": "0123456789abcdef",
        "outputs": [
          "157a3807a48faa9d",
          "d573529b34a1d093",
          "2f90b72e996dccbe",
          "a2d419334c4667ec"
        ]
      },
      {
        "seed": "ffffffffffffffff",
        "outputs": [
          "e4d971771b652c20",
          "e99ff867dbf682c9",
          "382ff84cb27281e9",
          "6d1db36ccba982d2"
        ]
      }
    ]
  },
  "resourceLimits": {
    "perRequestTimeoutMs": 30000,
    "maxResponseBytes": 8388608,
    "maxTotalRequests": 5000
  },
  "selection": {
    "profile": "consensus-legal-action-splitmix64-v1",
    "sourceOperation": "project-legal-actions",
    "drawsPerEvent": 1,
    "indexRule": "uint64-mod-action-count",
    "stopAtFirstDifference": true,
    "reproduction": "scenario-seed-event-prefix-v1"
  },
  "scenarios": [
    {
      "id": "placing-standard",
      "manifest": {
        "$json": "artifacts/mif-1.0/corpus/fixtures/example-morris@1.json"
      },
      "origin": "MFEN/1.0 mill24-state-v1 ......../......../........ b p p 9,9 - 0 0 -",
      "repetitionSeed": [],
      "preOriginClaims": [],
      "seeds": ["0000000000000000", "0000000000000001"],
      "maxLogicalTurns": 8,
      "maxEvents": 16,
      "replayEveryLogicalTurns": 4,
      "allowedStops": ["terminal", "logical-turn-limit"],
      "requiredCoverage": ["placing", "repetition"]
    },
    {
      "id": "moving-standard",
      "manifest": {
        "$json": "artifacts/mif-1.0/corpus/fixtures/example-morris@1.json"
      },
      "origin": "MFEN/1.0 mill24-state-v1 WWWW..../BBBB..../........ w m m 0,0 - 0 16 -",
      "repetitionSeed": [],
      "preOriginClaims": [],
      "seeds": ["0123456789abcdef", "deadbeefcafef00d"],
      "maxLogicalTurns": 8,
      "maxEvents": 16,
      "replayEveryLogicalTurns": 4,
      "allowedStops": ["terminal", "logical-turn-limit"],
      "requiredCoverage": ["moving", "repetition"]
    },
    {
      "id": "flying-three-pieces",
      "manifest": {
        "$json": "artifacts/mif-1.0/corpus/fixtures/example-morris@1.json"
      },
      "origin": "MFEN/1.0 mill24-state-v1 WWW...../BBB...../........ w m m 0,0 - 0 18 -",
      "repetitionSeed": [],
      "preOriginClaims": [],
      "seeds": ["0000000000000002", "0000000000000003"],
      "maxLogicalTurns": 6,
      "maxEvents": 12,
      "replayEveryLogicalTurns": 3,
      "allowedStops": ["terminal", "logical-turn-limit"],
      "requiredCoverage": ["moving", "flying", "repetition"]
    },
    {
      "id": "pending-removal",
      "manifest": {
        "$json": "artifacts/mif-1.0/corpus/fixtures/example-morris@1.json"
      },
      "origin": "MFEN/1.0 mill24-state-v1 BBB...../......../W....... b p r 8,6 b:mill:b:w:1:010000:w 0 4 -",
      "repetitionSeed": [],
      "preOriginClaims": [],
      "seeds": ["1111111111111111"],
      "maxLogicalTurns": 4,
      "maxEvents": 10,
      "replayEveryLogicalTurns": 2,
      "allowedStops": ["terminal", "logical-turn-limit"],
      "requiredCoverage": ["placing", "removal", "repetition"]
    },
    {
      "id": "claim-right-at-origin",
      "manifest": {
        "$json": "artifacts/mif-1.0/corpus/fixtures/example-morris@1.json"
      },
      "origin": "MFEN/1.0 mill24-state-v1 ......../......../........ b p p 9,9 - 0 0 -",
      "repetitionSeed": [
        {
          "source": "pre-origin",
          "key": {
            "$json": "artifacts/mif-1.0/corpus/instances/repetition-observation.json"
          }
        },
        {
          "source": "pre-origin",
          "key": {
            "$json": "artifacts/mif-1.0/corpus/instances/repetition-observation.json"
          }
        }
      ],
      "preOriginClaims": [],
      "seeds": ["2222222222222222"],
      "maxLogicalTurns": 1,
      "maxEvents": 2,
      "replayEveryLogicalTurns": 1,
      "allowedStops": ["terminal", "logical-turn-limit"],
      "requiredCoverage": ["placing", "claim-right", "repetition"]
    },
    {
      "id": "terminal-full-board",
      "manifest": {
        "$json": "artifacts/mif-1.0/corpus/fixtures/example-morris@1.json",